{
 "schema_version": "atlas-gate-manifest/v1",
 "gate": "G0",
 "generated_at": "2026-08-31T18:07:43+00:00",
 "commit": "c6dcd8028792e002e27fde39c6f60107f82da6fd",
 "pass": false,
 "tasks": [
  {
   "id": "BOOT-000",
   "status": "in_progress",
   "evidence_state": "missing",
   "receipt_ids": []
  },
  {
   "id": "BOOT-010",
   "status": "in_progress",
   "evidence_state": "self_asserted_only",
   "receipt_ids": [
    "rcpt_boot-010-a0-bootstrap"
   ]
  },
  {
   "id": "BOOT-020",
   "status": "in_progress",
   "evidence_state": "missing",
   "receipt_ids": []
  },
  {
   "id": "BOOT-030",
   "status": "in_progress",
   "evidence_state": "missing",
   "receipt_ids": []
  },
  {
   "id": "BOOT-040",
   "status": "in_progress",
   "evidence_state": "self_asserted_only",
   "receipt_ids": [
    "rcpt_boot-040-a0-bootstrap"
   ]
  },
  {
   "id": "BOOT-050",
   "status": "in_progress",
   "evidence_state": "self_asserted_only",
   "receipt_ids": [
    "rcpt_boot-050-a0-bootstrap"
   ]
  },
  {
   "id": "BOOT-080",
   "status": "in_progress",
   "evidence_state": "self_asserted_only",
   "receipt_ids": [
    "rcpt_boot-080-a0-bootstrap"
   ]
  },
  {
   "id": "FND-000",
   "status": "in_progress",
   "evidence_state": "missing",
   "receipt_ids": []
  },
  {
   "id": "FND-001",
   "status": "in_progress",
   "evidence_state": "self_asserted_only",
   "receipt_ids": [
    "rcpt_fnd-001-a0-bootstrap"
   ]
  },
  {
   "id": "FND-002",
   "status": "in_progress",
   "evidence_state": "missing",
   "receipt_ids": []
  },
  {
   "id": "FND-003",
   "status": "in_progress",
   "evidence_state": "missing",
   "receipt_ids": []
  },
  {
   "id": "FND-004",
   "status": "in_progress",
   "evidence_state": "missing",
   "receipt_ids": []
  },
  {
   "id": "FND-005",
   "status": "in_progress",
   "evidence_state": "missing",
   "receipt_ids": []
  },
  {
   "id": "FND-006",
   "status": "in_progress",
   "evidence_state": "missing",
   "receipt_ids": []
  },
  {
   "id": "FND-007",
   "status": "in_progress",
   "evidence_state": "missing",
   "receipt_ids": []
  },
  {
   "id": "HAR-000-01",
   "status": "in_progress",
   "evidence_state": "missing",
   "receipt_ids": []
  },
  {
   "id": "HAR-001-01",
   "status": "in_progress",
   "evidence_state": "missing",
   "receipt_ids": []
  },
  {
   "id": "HAR-002-01",
   "status": "in_progress",
   "evidence_state": "missing",
   "receipt_ids": []
  },
  {
   "id": "HAR-003-01",
   "status": "in_progress",
   "evidence_state": "missing",
   "receipt_ids": []
  },
  {
   "id": "HAR-005-01",
   "status": "in_progress",
   "evidence_state": "missing",
   "receipt_ids": []
  },
  {
   "id": "PLAN-002",
   "status": "in_progress",
   "evidence_state": "missing",
   "receipt_ids": []
  },
  {
   "id": "PLAN-001",
   "status": "in_progress",
   "evidence_state": "self_asserted_only",
   "receipt_ids": [
    "rcpt_plan-001-a0-bootstrap"
   ]
  }
 ],
 "missing_evidence": [
  "BOOT-000: no evidence receipt",
  "BOOT-020: no evidence receipt",
  "BOOT-030: no evidence receipt",
  "FND-000: no evidence receipt",
  "FND-002: no evidence receipt",
  "FND-003: no evidence receipt",
  "FND-004: no evidence receipt",
  "FND-005: no evidence receipt",
  "FND-006: no evidence receipt",
  "FND-007: no evidence receipt",
  "HAR-000-01: no evidence receipt",
  "HAR-001-01: no evidence receipt",
  "HAR-002-01: no evidence receipt",
  "HAR-003-01: no evidence receipt",
  "HAR-005-01: no evidence receipt",
  "PLAN-002: no evidence receipt"
 ],
 "missing_operator_decisions": [],
 "notes": "G0 evidence policy: passing self-asserted receipts accepted because clean-checkout CI does not exist until PLT-004 (G1); G0 task receipts are re-derived from clean CI at G1 (BOOT-060/070). Disclosed per SPEC 0.3(15)."
}
